{"scene_version":1,"units":"meters","coordinate_system":"X/Y plan, Z up","object_count":6,"vertex_count":64,"index_count":264,"objects":[{"element_id":2,"kind":"Wall","level_id":1,"selectable":true,"visible_by_default":true,"revision":11,"material_category":"structural","bounds":{"min":{"x":-0.1,"y":-0.1,"z":0},"max":{"x":6.1,"y":0.1,"z":3}},"mesh":{"positions":[{"x":-0.1,"y":-0.1,"z":0},{"x":6,"y":-0.1,"z":0},{"x":6.1,"y":0.1,"z":0},{"x":0,"y":0.1,"z":0},{"x":-0.1,"y":-0.1,"z":3},{"x":6,"y":-0.1,"z":3},{"x":6.1,"y":0.1,"z":3},{"x":0,"y":0.1,"z":3},{"x":0.75,"y":-0.1,"z":0},{"x":1.65,"y":-0.1,"z":0},{"x":1.65,"y":-0.1,"z":2.1},{"x":0.75,"y":-0.1,"z":2.1},{"x":0.75,"y":0.1,"z":0},{"x":1.65,"y":0.1,"z":0},{"x":1.65,"y":0.1,"z":2.1},{"x":0.75,"y":0.1,"z":2.1}],"indices":[0,2,1,4,5,6,0,3,2,4,6,7,0,1,5,0,5,4,1,2,6,1,6,5,2,3,7,2,7,6,3,0,4,3,4,7,8,12,15,8,15,11,9,10,14,9,14,13,11,15,14,11,14,10,8,9,13,8,13,12]}},{"element_id":6,"kind":"Door","level_id":1,"selectable":true,"visible_by_default":true,"revision":11,"material_category":"generic","bounds":{"min":{"x":0.75,"y":-0.05,"z":0},"max":{"x":1.65,"y":0.05,"z":2.1}},"mesh":{"positions":[{"x":0.75,"y":-0.05,"z":0},{"x":1.65,"y":-0.05,"z":0},{"x":1.65,"y":0.05,"z":0},{"x":0.75,"y":0.05,"z":0},{"x":0.75,"y":-0.05,"z":2.1},{"x":1.65,"y":-0.05,"z":2.1},{"x":1.65,"y":0.05,"z":2.1},{"x":0.75,"y":0.05,"z":2.1}],"indices":[0,1,2,0,2,3,4,6,5,4,7,6,0,4,5,0,5,1,1,5,6,1,6,2,2,6,7,2,7,3,3,7,4,3,4,0]}},{"element_id":3,"kind":"Wall","level_id":1,"selectable":true,"visible_by_default":true,"revision":12,"material_category":"structural","bounds":{"min":{"x":5.9,"y":-0.1,"z":0},"max":{"x":6.1,"y":4.1,"z":3}},"mesh":{"positions":[{"x":6.1,"y":-0.1,"z":0},{"x":6.1,"y":4,"z":0},{"x":5.9,"y":4.1,"z":0},{"x":5.9,"y":0,"z":0},{"x":6.1,"y":-0.1,"z":3},{"x":6.1,"y":4,"z":3},{"x":5.9,"y":4.1,"z":3},{"x":5.9,"y":0,"z":3},{"x":6.1,"y":1.2,"z":1},{"x":6.1,"y":2.4,"z":1},{"x":6.1,"y":2.4,"z":2.2},{"x":6.1,"y":1.2,"z":2.2},{"x":5.9,"y":1.2,"z":1},{"x":5.9,"y":2.4,"z":1},{"x":5.9,"y":2.4,"z":2.2},{"x":5.9,"y":1.2,"z":2.2}],"indices":[0,2,1,4,5,6,0,3,2,4,6,7,0,1,5,0,5,4,1,2,6,1,6,5,2,3,7,2,7,6,3,0,4,3,4,7,8,12,15,8,15,11,9,10,14,9,14,13,11,15,14,11,14,10,8,9,13,8,13,12]}},{"element_id":7,"kind":"Window","level_id":1,"selectable":true,"visible_by_default":true,"revision":12,"material_category":"glass","bounds":{"min":{"x":5.95,"y":1.2,"z":1},"max":{"x":6.05,"y":2.4,"z":2.2}},"mesh":{"positions":[{"x":6.05,"y":1.2,"z":1},{"x":6.05,"y":2.4,"z":1},{"x":5.95,"y":2.4,"z":1},{"x":5.95,"y":1.2,"z":1},{"x":6.05,"y":1.2,"z":2.2},{"x":6.05,"y":2.4,"z":2.2},{"x":5.95,"y":2.4,"z":2.2},{"x":5.95,"y":1.2,"z":2.2}],"indices":[0,1,2,0,2,3,4,6,5,4,7,6,0,4,5,0,5,1,1,5,6,1,6,2,2,6,7,2,7,3,3,7,4,3,4,0]}},{"element_id":4,"kind":"Wall","level_id":1,"selectable":true,"visible_by_default":true,"revision":8,"material_category":"structural","bounds":{"min":{"x":-0.1,"y":3.9,"z":0},"max":{"x":6.1,"y":4.1,"z":3}},"mesh":{"positions":[{"x":6.1,"y":4.1,"z":0},{"x":0,"y":4.1,"z":0},{"x":-0.1,"y":3.9,"z":0},{"x":6,"y":3.9,"z":0},{"x":6.1,"y":4.1,"z":3},{"x":0,"y":4.1,"z":3},{"x":-0.1,"y":3.9,"z":3},{"x":6,"y":3.9,"z":3}],"indices":[0,2,1,4,5,6,0,3,2,4,6,7,0,1,5,0,5,4,1,2,6,1,6,5,2,3,7,2,7,6,3,0,4,3,4,7]}},{"element_id":5,"kind":"Wall","level_id":1,"selectable":true,"visible_by_default":true,"revision":6,"material_category":"structural","bounds":{"min":{"x":-0.1,"y":-0.1,"z":0},"max":{"x":0.1,"y":4.1,"z":3}},"mesh":{"positions":[{"x":-0.1,"y":4.1,"z":0},{"x":-0.1,"y":0,"z":0},{"x":0.1,"y":-0.1,"z":0},{"x":0.1,"y":4,"z":0},{"x":-0.1,"y":4.1,"z":3},{"x":-0.1,"y":0,"z":3},{"x":0.1,"y":-0.1,"z":3},{"x":0.1,"y":4,"z":3}],"indices":[0,2,1,4,5,6,0,3,2,4,6,7,0,1,5,0,5,4,1,2,6,1,6,5,2,3,7,2,7,6,3,0,4,3,4,7]}}]}